section,text
Boundaries -> Rhode Island eastern border,"In 1641, the Plymouth Colony (at the time separate from the Massachusetts Bay Colony) purchased from the Indians a large tract of land which today includes the northern half of East Providence (from Watchemoket to Rumford), Rehoboth, Massachusetts, Seekonk, Massachusetts, and part of Pawtucket, Rhode Island. In 1645, John Brown of Plymouth bought a considerably smaller piece of land from the Indians, which today comprises the southern part of East Providence (Riverside), Barrington, Rhode Island, and a small part of Swansea, Massachusetts. Finally, in 1661, Plymouth completed the ""North Purchase"", from which Cumberland, Rhode Island, Attleboro, Massachusetts, and North Attleborough, Massachusetts, were later to be formed. The whole territory, which also included parts of modern Somerset, Massachusetts, and Warren, Bristol, and Woonsocket in Rhode Island, was at the time called ""Rehoboth"". The center of ""Old Rehoboth"" was within the borders of modern East Providence, Rhode Island.
By the 1650s, Massachusetts Bay, the Colony of Rhode Island (not yet unified with Providence) the Connecticut Colony, and two different land companies all claimed what is now Washington County, Rhode Island, what was referred to as Narragansett Country. Massachusetts Bay had conquered Block Island in 1636 in retaliation for the murder of a trader at the start of the Pequot War, and Massachusetts families settled there in 1661. The Plymouth Colony's land grant specified its western boundary as the Narragansett River; it is unclear whether this referred to the Pawcatuck River (on the current Connecticut–Rhode Island Border) or Narragansett Bay (much farther east, near the modern-day Rhode Island–Massachusetts border).
In 1663, Rhode Island obtained a patent extending its territory in certain places three miles east of Narragansett Bay. In 1664, a royal commission appointed by King Charles II of England denied the claims of Massachusetts and Plymouth to land west of Narragansett Bay, granting jurisdiction to the newly unified Colony of Rhode Island and Providence Plantations (pending resolution of the claims of Connecticut). However, the claims of Plymouth to all lands east of Narragansett Bay were upheld, and so the border was set in practice.
The 1691 charter unified Massachusetts Bay with Plymouth Colony (including Rehoboth) and said that the combined territory would extend as far south as ""Our Collonyes of Rhode Island Connecticut and the Narragansett Countrey"" (Narragansett Country).
In 1693, the monarchs William III and Mary II issued a patent extending Rhode Island's territory to three miles ""east and northeast"" of Narragansett Bay, conflicting with the claims of Plymouth Colony. This enlarged the area of conflict between Rhode Island and the Province of Massachusetts.
The issue was not addressed until 1740, when Rhode Island appealed to King George II of Great Britain. Royal commissioners from both colonies were appointed in 1741, and decided in favor of Rhode Island. The King affirmed the settlement in 1746 after appeals from both colonies. The royally approved three-mile boundary moved several towns on the eastern shore of Narragansett Bay (east of the mouth of the Blackstone River) from Massachusetts to Rhode Island.
This included what is now Bristol County, Rhode Island (the towns of Barrington, Bristol, and Warren), along with Tiverton, Little Compton, and Cumberland, Rhode Island (which was carved out of Attleborough, Massachusetts). East Freetown, which was left on the Massachusetts side of the border, was officially purchased by Freetown, Massachusetts, from Tiverton in 1747.
Commissioners from Rhode Island had the new boundary surveyed in 1746 (without consulting Massachusetts), based on six reference points, from each of which a distance was measured 3 miles inland. Massachusetts accepted this border until 1791, when its own surveyors found that the Rhode Island surveyors had ""encroached"" on Massachusetts territory by a few hundred feet in certain places.  (Rhode Island disagreed.)  Of particular concern was the boundary near Fall River, Massachusetts, which would later fall in the middle of a thickly settled area of high taxable value.
In 1812, after a court case involving the Massachusetts border, the western half of Old Rehoboth was set off as a separate township called Seekonk, Massachusetts, leaving the eastern part as Rehoboth, Massachusetts. Old Rehoboth's town center now became the heart of Old Seekonk.
In 1832, Rhode Island filed a case with the U.S. Supreme Court, but after six years of deliberations, it was dismissed. The court decided it did not have the jurisdiction to rule on the matter.
In 1844, and 1845, commissioners were once again authorized to survey and mark the boundary from Wrentham to the Atlantic Ocean, to address the inaccuracies of the 1746 survey. A report was issued in 1848, but the Massachusetts legislature refused to agree to the proposed solution after petitions from residents of Fall River.
Both states filed bills of equity with the Supreme Court in 1852, and after more surveying and negotiation, a decree was issued on December 16, 1861. On March 1, 1862, when the Supreme Court ruling became effective, the western part of Old Seekonk (all of which was on the eastern shore of the Blackstone River) was ceded by Massachusetts and incorporated as East Providence, Rhode Island. Part of North Providence, Rhode Island, was also combined with the former Pawtucket, Massachusetts and a sliver of Seekonk to form the modern Pawtucket, Rhode Island. A small amount of land was also added to Westport, Massachusetts. The southern boundary of Fall River, Massachusetts, was moved from Columbia Street to State Avenue, expanding its territory. The Supreme Court made these adjustments not in conformance with King George's instructions, but to unify the thickly settled areas of Pawtucket and Fall River under the jurisdiction of a single state.
The 1861–2 boundary was slightly redefined in 1897, using stone markers instead of high-water levels. The physical survey was performed in 1898, and ratified by both states."
Boundaries -> Rhode Island northern border,"In 1710–11, commissioners from the Colony of Rhode Island and Providence Plantations and the Province of Massachusetts Bay agreed that the stake planted in 1642 by Nathaniel Woodward and Solomon Saffrey at Burnt Swamp Corner on the plains of Wrentham, Massachusetts, said to be at 41°55′N and thought to be three miles south of the southernmost part of the Charles River, would represent the starting point for the border.
The line extending west from the stake was surveyed in 1719, but inaccurately.
In 1748, Rhode Island appointed a commission to survey the line from the stake to the Connecticut border, but Massachusetts failed to send a delegation. The surveyors could not find the 1642 stake, and so marked a line from three miles south, by their reckoning, of ""Poppatolish Pond"" (presumably Populatic Pond, near Norfolk Airpark in Norfolk, Massachusetts). It was discovered that the Woodward and Saffrey stake was considerably farther south than three miles from the Charles River.
Rhode Island claimed that its commissioners had made a mistake in basing the border on the 1642 stake, and in 1832 filed a case with the Supreme Court of the United States. In 1846, the Court ruled in favor of Massachusetts. The same surveyors that marked the eastern boundary the previous year then marked the northern boundary, filing their report in 1848. Rhode Island accepted the markings as the legal boundary on the condition that Massachusetts do the same, but the Commonwealth failed to do so until 1865. But by that time, Rhode Island claimed that the 1861 Supreme Court case had changed matters so much as to render the ""line of 1848"" unacceptable."
Boundaries -> Connecticut border,"The town of Springfield was settled in 1636 by William Pynchon (as Agawam Plantation), encompassing the modern towns of Westfield, Southwick, West Springfield, Agawam, Chicopee, Holyoke, Wilbraham, Ludlow and Longmeadow in Massachusetts, and Enfield, Suffield, Somers, and East Windsor in Connecticut. It was connected to the Atlantic and major avenues of trade by the Connecticut River, which ran past Hartford and through the territory of the Connecticut Colony. Initially, Springfield's founders attended the Connecticut Colony meetings held in Hartford; however, relations quickly soured between the strong-minded leaders of each settlement, the iconoclastic William Pynchon of Springfield and Puritan Reverend Thomas Hooker of Hartford. Pynchon proved to be a very savvy businessman, and his settlement quickly eclipsed the Connecticut towns in trade with the Natives. In 1640, during a grain shortage, Hooker and other Connecticut leaders gave Pynchon permission to buy grain for them; however, because the Indians were refusing to sell at reasonable prices, Pynchon refused the Indians' offers. Pynchon's perceived greed infuriated Hartford; however, Pynchon explained that he was merely trying to keep market prices steady so that colonists need not pay exorbitant amounts in the future. Infuriated, Hartford sent famed Indian-killer Captain John Mason up to Pynchon's settlement ""with money in one hand and a sword in the other."" Mason threatened the Natives by Springfield with war if they did not sell grain at the prices he demanded. Pynchon was disgusted by this behavior, as he had enjoyed a congenial relationship with the Natives – and Mason's threats made him look bad. Mason believed that Natives were untrustworthy, and thus exchanged some ""hard words"" with Pynchon before leaving Springfield. After Mason left, settlers of Agawam Plantation rallied in support of Pynchon. In 1640, they voted to annex their settlement – with arguably the best position on the Connecticut River, near Enfield Falls, surrounded by fertile farmland and friendly Natives – to the faraway government in Boston, rather than the nearby government in Hartford. (Springfield had been settled by permission of the Massachusetts General Court, so Massachusetts assumed it had jurisdiction over Pynchon's settlement anyway; however, they renamed it Springfield in Pynchon's honor).
In 1641, Connecticut founded a trading post at Woronoke, which was in what was strongly considered to be Massachusetts territory (now Westfield). Massachusetts complained, and Connecticut demanded that Springfield pay taxes to support the upkeep of the fort at the mouth of the river, in the Saybrook Colony. Springfield's magistrate, William Pynchon, would have been amenable to the tax if Springfield could have representation at the fort at Saybrook; however, Connecticut refused Springfield's request for representation. Pynchon appealed to Boston, which responded to Connecticut by threatening to charge Connecticut traders for the use of the port of Boston on which they heavily depended.
To assert its sovereignty on the northern Connecticut River, the Massachusetts Bay Colony sent Nathaniel Woodward and Solomon Saffrey to survey and mark the boundary. They accidentally marked the boundary with Rhode Island significantly farther than the royally decreed three miles south of the southernmost part of the Charles River. Instead of traversing the territory of Massachusetts by land, they sailed around and up the Connecticut River, calculating the same latitude at which they had misplaced the stake on the Rhode Island border. This compounded the error even further, resulting in a four to seven mile discrepancy between where the border should have been and where it was marked, and awarding more territory to Massachusetts Bay than it had been granted by its charter. Although it was suspicious of this survey, Connecticut would not even receive a charter until 1662, and so the dispute would lie dormant for several decades.
The towns of Woodstock, Suffield, Enfield, and Somers were incorporated by Massachusetts, and mainly settled by migrants from the Massachusetts Bay and Plymouth Colonies. In 1686, Suffield and Enfield (incorporated in Massachusetts) were in a dispute over town territory with Windsor and Simsbury (incorporated in Connecticut, and which then included Granby). Massachusetts did not agree to a re-survey, so Connecticut hired John Butler and William Whitney to do the job. They found the southernmost part of the Charles River, and then traveled by land westward. Their 1695 report found that the 1642 line had been drawn too far south.
Consternation ensued. Abortive pleas to England were made in 1702. In 1713, a joint commission awarded control of Springfield-area towns to Massachusetts (without consulting the residents of those towns), compensating Connecticut with an equal amount of land further north. But the inhabitants of the Connecticut River border towns petitioned to be part of Connecticut in 1724, perhaps due to high taxes in Massachusetts or the greater civil liberties granted in the Connecticut charter.
In 1747, Woodstock petitioned the General Assembly of Connecticut to be admitted to the colony because the transfer of lands from Massachusetts in 1713 had not been authorized by The Crown. Suffield and Enfield soon followed, and the legislature accepted them in May 1749, and declared the 1713 compromise null and void. Massachusetts continued to assert sovereignty.
In 1770, Southwick, Massachusetts, was granted independence from Westfield, Massachusetts. In May 1774, residents in southern Southwick also petitioned Connecticut for entry and secession from northern Southwick, on the grounds they were south of the royally approved border of the Massachusetts Bay Colony (three miles south of the Charles River). As a compromise, the area west of Congamond Lake remained in Massachusetts, and the area of Massachusetts east of the lake joined Suffield and became part of Connecticut.
In 1791, and 1793, commissioners were sent from both states to survey the boundary line yet again, but were unable to agree until a compromise was reached in 1803–04. Massachusetts accepted the nullification of the 1713 compromise and the loss of the border towns, but regained the portion of southern Southwick west of the lake. This resulted in the modern boundary with Connecticut, a relatively straight east–west line except for the ""Southwick jog"", a small, mostly rectangular piece of Massachusetts surrounded by Connecticut on three sides."
Boundaries -> New York border,"Massachusetts claimed all territory to the Pacific Ocean, based on its 1629 charter, but the Province of New York claimed the west bank of the Connecticut River (passing through Springfield, Massachusetts) as its eastern boundary, based on 1664 and 1674 grants to the Duke of York. The 1705 Westenhook Patent from the governor of New York allocated land west of the Housatonic River to specific individuals, resulting in ownership conflicts.
In 1773, the western boundary of Massachusetts was settled with New York in its present location, and surveyed in 1787, following the line of magnetic north at the time. The starting point was a 1731 marker at the Connecticut–New York border, 20 miles inland from the Hudson River.
Massachusetts relinquished sovereignty over its western lands (east of the Great Lakes) to New York in the Treaty of Hartford in 1786, but retained the economic right to buy the Boston Ten Townships from Native Americans before any other party. These purchase rights were sold to private individuals in 1788. The Commonwealth also ceded its claim to far western lands (Michigan and all other land to the Pacific Ocean) to Congress in 1785.
In 1853, a small triangle of land in the southwest corner of the Commonwealth, known as Boston Corner, was ceded from Mount Washington, Massachusetts, to Ancram, New York. The mountainous terrain made it difficult for Massachusetts authorities to enforce the law there, making the neighborhood a haven for outlaws and prize-fighters. Residents petitioned for the transfer to allow New York authorities to clean up the hamlet."
Boundaries -> Maine,"From 1658 to 1820 Maine was an integral part of Massachusetts. In 1820, Maine was separated from Massachusetts (with its consent) and admitted into the Union as an independent state, as part of the Missouri Compromise.  (See the History of Maine for information about its boundaries, including disputes with New Hampshire and Canadian provinces.)"
Notes,
