section,text
21st century -> Finance board: 2004–2009,"Springfield began experiencing fiscal trouble during the 1980s; however, the city's finances nearly collapsed in the first decade of the 21st century with budget shortfalls of approximately $40 million. City and state officials disagreed over the crisis' causes. The State blamed overspending relative to income by the City. City officials blamed inequities in the ways additional assistance appropriations were allocated to Springfield relative to other Massachusetts cities. Both sides were correct. Springfield was overspending relative to its income, as the Commonwealth claimed. However, Springfield officials were also correct – for every $287.66 per capita in additional assistance appropriations allocated to Boston, $176.37 per capita were allocated to Cambridge, $67.50 per capita were allocated to Worcester, and a mere $12.04 per capita were allocated to Springfield. Aside from overspending and gross inequities in State funding, other observers of Springfield's fiscal crisis noted a weak economy, years of incompetent management, and corruption in city government.
The city's financial problems had already resulted in wage freezes for city workers, cuts in city services, layoffs, and various city fee increases; however, on June 30, 2004, the Massachusetts General Court granted control of the city (including financial, personnel, and real estate matters) to the Springfield Finance Control Board. The board was composed of three appointees by the State Secretary of Administration and Finance, Springfield's Mayor, and the President of the City Council.
The Financial Control Board (FCB) operated under the overall direction of the State Secretary of Finance and Administration. The FCB legislation included a state loan of $52 million to be paid back with future city tax receipts. A $20 million grant was originally included, but then-House Speaker Thomas Finneran eliminated that section, fearing it would invite fiscal irresponsibility among other municipalities.
The original FCB bill filed by then-Governor Mitt Romney included a suspension of Massachusetts General Law Chapter 150E, the state law that defines the collective bargaining process for public employees. (State employees are not covered by federal labor laws). Opposition from unions eliminated that section.
During the first several years of the Financial Control Board, officials concentrated on ""controlling personnel costs,"" However, in 2006 the FCB hired the Urban Land Institute to study Springfield and then conceive a viable plan for the city's revitalization. The ULI's study and subsequent 'Plan for Springfield' resulted in significant improvements throughout Springfield's Metro Center, a dramatic citywide drop-off in crime, and a viable course for the city's continued resurgence.
On June 30, 2009, the State of Massachusetts disbanded the Finance Control Board and returned financial control to the City of Springfield"
"21st century -> Revitalization: 2007 – June 1, 2011 -> Decrease in crime","Since 1997, U.S. and local crime statistics indicate that Springfield experienced a decrease in both violent crime and property crime, with both falling over 50%. Crime numbers bottomed out in 2009, increasing negligibly in 2010 and 2011. Independent sources also note Springfield's decrease in criminal activity, including
Morgan Quinto's annual ""United States City Crime Rankings,"" which also show a 50% drop-off in the city's overall crime. In 2010, Springfield ranked 51st in those rankings, in which it had once – in just 2003 – ranked 18th."
"21st century -> Revitalization: 2007 – June 1, 2011 -> Springfield's mature economy: healthcare; higher education; and transportation","From 2007 to 2010, Springfield prospered economically in relation to its peer cities, while enduring ""the worst American economic crisis since the Great Depression."" Springfield is considered to have a ""mature"" economy, built on primarily healthcare, higher education, transportation, and to an extent, a still existent precision manufacturing center, (e.g. Smith & Wesson added 225 jobs in 2011.) 
Major private medical investments have included Baystate Health's $300 million ""Hospital of the Future"". It has been reported that, on its completion in 2012, Baystate will hire 550 new doctors, approximately doubling the hospital's current capacity.
In 2010, two of Springfield's most prestigious higher education institutions built multimillion-dollar facilities, which opened in 2011. Springfield College constructed a $45 million multi-purpose university center, while Western New England University constructed a $40 million pharmacy school – the only such school in the region. In 2010, the University of Massachusetts Amherst moved its Urban Design graduate program to Court Square in Metro Center. In early 2011, UMass Amherst announced that it would move its popular radio station WFCR to Springfield's Main Street.
During Springfield's brief renaissance, the city's largest proposed monetary investment occurred in rail infrastructure – specifically, in the proposed, first-ever in the United States high-speed rail line. That proposal was an approximately $1 billion investment  shared with the State of Connecticut and the U.S. Federal Government in the New Haven-Hartford-Springfield commuter rail line. According to NHHSRail, the project's oversight body, Springfield-New Haven high-speed commuter rail will be fully functional by 2016, featuring a northern terminus at Springfield's Union Station and a southern terminus at New Haven's Union Station. It is reported that trains will reach speeds of 110 mph (180 km/h), making the Springfield-New Haven intercity commuter line the first truly ""high-speed train"" in the United States. Additionally, Amtrak's Vermonter runs through downtown Springfield. The Vermonter is in the process of being re-aligned to the former Montrealer route, through the more populous Pioneer Valley cities of Chicopee and Northampton, as opposed to smaller towns like Palmer."
"21st century -> Springfield tornado of June 1, 2011","On June 1, 2011, at approximately 4:45pm, the City of Springfield was directly hit by a tornado with wind speeds estimated at 160 mph (260 km/h), (a high-end EF3 on the Enhanced Fujita Scale), which, according to the National Weather Service, was the 2nd largest ever to have hit New England – the 1953 tornado in Worcester, Massachusetts, was slightly larger. The National Oceanographic and Atmospheric Administration called the Springfield Tornado ""very significant... Noted not only for its intensity but also for the length of its continuous damage path – approximately 39 miles. The tornado was also very wide at some points, reaching a maximum width of one-half mile."" According to Massachusetts Governor Deval Patrick, Springfielders were given only 10 minutes warning that a tornado was approaching the densely populated city. CNN delayed warning of the impending tornado due to a live interview with New York Congressman Anthony Weiner, who was discussing explicit photographs of himself that he had posted online.
The Greater Springfield tornado left four people dead, hundreds of people suffering in hospitals with injuries ranging from lightning strikes to trauma, and over 500 people homeless in the City of Springfield alone, most of whom stayed at the MassMutual Center arena and convention center. Over two weeks after the disaster, more than 250 people were still living at the MassMutual Center, homeless.
The tornado crossed over the Connecticut River from West Springfield, Massachusetts, into the City of Springfield near the Springfield Memorial Bridge. First, it caused extensive damage to Springfield's Connecticut River Walk Park, deforesting much of the park's formerly lush tree canopy and removing large sections of its attractive wrought-iron fencing. Next it damaged Court Square – Springfield's historic center – ripping off parts of the Old First Church (established in 1637), and uprooting approximately half of Court Square's 200-year-old ""heritage trees."" Then the tornado proceeded southward down Main Street, devastating Springfield's historically Italian South End. In less than two minutes, much of the South End's commercial district – built more than a century ago and consisting of mostly brick, commercial buildings – lay in complete ruins, while the South End's recent improvements, e.g. new ornate, street lamps, were either bent or flung far from their places of origin.
After devastating the South End, the tornado moved east and headed up historic Maple Street, on and around which it caused significant damage. It seriously damaged the campus of MacDuffie School. Less than a mile eastward, large sections of Springfield College and the Old Hill neighborhood were completely destroyed, as were hundreds of homes in East Forest Park, an upper-middle-class neighborhood. East Forest Park's Cathedral High School was completely ravaged by the tornado. Due to the experience with these tornadoes, Springfield College's twelfth (and incumbent) president Dr. Richard B. Flynn of Omaha, Nebraska, turned a ten-month-to-a-year restoration of campus into a ten-week project. Debris from Cathedral was found roughly 43 mi (69 km) away in Millbury, Massachusetts. Springfield's most suburban neighborhood – the upper-middle-class Sixteen Acres – also incurred significant damage. However, Sixteen Acres' newer homes did not weather the tornado any better than did Springfield's famous Victorians. The East Forest Park and Sixteen Acres neighborhoods remained without power for days. In Springfield, the tornado completely destroyed over 100 homes, made countless others structurally unsound or uninhabitable, and caused other structures deemed hazardous to be quickly demolished.
Immediately following the tornado, Governor Deval Patrick declared a ""State of Emergency"" for the entire Commonwealth of Massachusetts. That day, United States Senator from Massachusetts John F. Kerry cited city damages as ""astronomical... well beyond tens of millions of dollars."" As of June 18, 2011, there have been over $140 million in tornado-related insurance claims."
"""Firsts"" in Springfield","The City of Springfield is known as the City of Firsts because, throughout the centuries, its citizens have boldly created avant-garde products, organizations, and ideas. Today, the most famous among Springfield's ""firsts"" is the sport of basketball, invented in 1891 and now the world's second most popular sport. Below is a partial list of the City of Springfield's ""firsts:"""
