section,text
18th century -> Shays' Rebellion -> The Battle of the U.S. Arsenal at Springfield,"By January 1787, thousands of men from Western Massachusetts, Eastern New York, Vermont, and Connecticut had joined the Regulators; however, many were scattered across the expanse of Western Massachusetts. On January 25, 1787, three major Regulator armies were coalescing on Springfield in attempt to overtake the U.S. Federal Arsenal at Springfield. The armies were commanded by, respectively, Daniel Shays, whose army was camped in nearby Palmer, Massachusetts; Luke Day, whose army was camped across the Connecticut River in West Springfield, Massachusetts; and Eli Parsons, whose army was camped just north of Springfield in Chicopee, Massachusetts. The plan for commandeering the Arsenal at Springfield was for a three-pronged attack on January 25, 1787; however, the day before the scheduled attack, General Luke Day unilaterally postponed the attack to January 26, 1787. Day sent a note postponing the attack to both Shays and Parsons; however, it never reached them.
On January 25, 1787, Shays's and Parson's armies approached the Arsenal at Springfield expecting Day's army to back them up. General William Shepard's Massachusetts militia – which had been withered by defections to the Regulators – was already inside the Arsenal. General Shepard had requested permission from U.S. Secretary of Defense Henry Knox to use the weaponry in the Arsenal, because technically its firepower belonged to the United States, and not the Commonwealth of Massachusetts. Secretary of War Henry Knox denied the request on the grounds that it required Congressional approval and that Congress was out of session; however, Shepard used the Arsenal's weapons anyway.
When Shays, Parsons, and their forces neared the Arsenal, they found Shepard's militia waiting for them – and they were baffled by the location of Luke Day's army. Shepard ordered a warning shot. Two cannons were fired directly into Shays's men. Four of the Shaysites were killed, and thirty were immediately wounded. No musket fire took place. The rear of Shays's army ran, leaving his Captain James White ""casting a look of scorn before and behind,"" and then fled. Without reinforcements from Day, the rebels were unsuccessful in taking the Springfield Arsenal.
The militia captured many of the rebels on February 4 in Petersham, Massachusetts. Over the course of the next several weeks, the rebels were dispersed; however, skirmishes continued for approximately a year thereafter.
Governor Bowdoin declared that Americans would descend into ""a state of anarchy, confusion, and slavery"" unless the rule of the law was upheld. Shays's Rebellion, however, was – like American Revolution – an armed uprising against a rule of law perceived to be unjust. Ultimately, Shays's Rebellions' legacy is the United States Constitution."
19th century -> The City of Progress,"The City of Springfield, and, in particular, the Springfield Armory played an important role in the early Industrial Revolution. As of 2011, Springfield is nicknamed The City of Firsts; however, throughout the 19th and early 20th centuries, its nickname was The City of Progress. Throughout its history, Springfield has been a center of commercial invention, ideological progress, and technological innovation. For example, in 1819, inventor Thomas Blanchard and his lathe led to the uses of interchangeable parts and assembly line mass production, which went on to influence the entire world – while originally making arms production at The Springfield Armory faster and less expensive. Blanchard – and Springfield – are credited with the discovery of the assembly line manufacturing process. Blanchard also invented the first modern car in Springfield, a ""horseless carriage"" powered by steam.
The first American-English dictionary was produced in Springfield in 1806 by the company now known as Merriam Webster. Merriam Webster continues to maintain its worldwide headquarters in Springfield, just north of the Springfield Armory.
In Springfield, ""The City of Progress,"" many products were invented that are still popular and necessary today. For example, in 1844, Charles Goodyear perfected and patented vulcanized rubber at his factory in Springfield. (The automobile had not yet been invented, so Goodyear patented his rubber stamp rather than tires, for which he later became known). In 1856, the world's first-ever adjustable monkey wrench was invented in Springfield. In 1873, America's first postcard was invented in Springfield by the Morgan Envelope Factory. Also, America's first horse show and dog show were both produced in Springfield – 1853 and 1875, respectively.
Well known for it “firsts,"" Springfield also has the distinction of being the last New England city to free another state's slave. In Massachusetts, the cruel institution was outlawed by 1783, in a court decision based on the 1780 Massachusetts Constitution. In 1808, a man from New York – where slavery, at the time, was legal – came to Springfield demanding the return of his escaped slave: a woman named Jenny who had been living in Springfield for several years. In a show of support for abolitionism, the citizens of Springfield, among them Bezaleel Howard, raised enough money to buy Jenny's freedom from the New Yorker. Jenny lived a free woman in Springfield thereafter.
John Brown, the celebrated abolitionist and hero of John Brown's raid on Harpers Ferry, became a national leader in the abolitionist movement while living in Springfield. Indeed, Springfield's role in the abolitionist movement was far greater than the city's population at the time, (approximately 20,000 before the separation of Chicopee). In 1836, Springfield's American Colonization Society was its first radical abolitionist group. Nearly all Springfielders – from its wealthiest merchants to its influential newspaper publisher – supported abolitionism. In 1846, Brown moved into this progressive climate and set up a wool commission. Brown began attending church services at the traditionally black Sanford Street Church (now St. John's Congregational Church.) In Springfield, Brown spoke with Frederick Douglass and Sojourner Truth, while learning about the successes of Springfield's Underground Railroad. Also, in Springfield, Brown met many of the contacts he would need in later years to fund his work in Bleeding Kansas. In 1850, in response to the passage of the Fugitive Slave Act, John Brown formed his first militant anti-slavery organization in Springfield: The League of Gileadites. Brown founded the group by saying, ""Nothing so charms the American people as personal bravery. [Blacks] would have ten times the number [of whites friends than] they now have were they but half as much in earnest to secure their dearest rights as they are to ape the follies and extravagances of their white neighbors..."" The League of Gileadites protected slaves who escaped to Springfield from slaver-catchers. After the foundation of Brown's organization in 1850, a slave was never again ""captured"" in the city. As of 2011, St. John's Congregational Church – one of the Northeast's most prominent black congregations, now celebrating its 167th year in existence – still displays John Brown's Bible.
Even following the Civil War, Springfield remained a locus of early black culture, as the place where Irvine Garland Penn's The Afro-American Press and Its Editors was first published in 1891. Among the notable residents of the city was Primus P. Mason, a real estate investor of the city for whom Mason Square is so named, who donated his estate to found the Mason-Wright Retirement Home. In his book Efforts for Social Betterment Among Negro Americans W.E.B. DuBois described Mason as ""one of the chief Negro Philanthropists of our time"" for his creation of what Mason himself wrote in his will of ""a place where old men that are worthy may feel at home"".
In 1852, Springfield was chartered as a city; however, only after decades of debate, which, in 1848, resulted in the partitioning off of the northern part of Springfield into Chicopee, Massachusetts – in order to reduce Springfield's land and population. The partition of Chicopee from Springfield deprived Springfield of approximately half of its territory and approximately two-thirds of its population. To this day, the two cities of Springfield and Chicopee have relatively small land areas and remain separate. Springfield's first mayor was Caleb Rice, who was also the first President of MassMutual Life Insurance Company. As of 2011, the MassMutual Life Insurance Company, headquartered in Springfield, is the second wealthiest company from Massachusetts listed in the Fortune 100.

Wason Manufacturing Company of Springfield – one of the United States' first makers of railway passenger coach equipment – produced America's first sleeping car in 1857, (also known as a Pullman Car). On May 2, 1849, the Springfield Railroad was chartered to build from Springfield to the Connecticut state line. By the 1870s the endeavor had become the Springfield and New London Railroad.
In 1855, the formation of the Republican Party was championed by Samuel Bowles III, publisher of the influential Springfield daily newspaper, The Republican. The Republican Party took its name from Bowles' newspaper. On Friday, September 21, 1855, the headline in The Republican read: “The Child is Born!” This marked the birth of the Republican Party. By 1858, the Republicans had taken control of many Northern States' governments. In 1860, Bowles was on the train to the Republican convention in Chicago where his friend, Springfield lawyer George Ashmun, was elected chairman of the convention that would eventually nominate Abraham Lincoln for president.
In 1856, Horace Smith and Daniel B. Wesson formed Smith & Wesson to manufacture revolvers. Smith & Wesson has gone on to become the largest and, it can be argued, the most famous gun manufacturer in the world. The company's headquarters remains in Springfield and as of 2011, employs over 1200 workers.

By 1870 the expansion of industry had created the opportunity for the creation of a trolley system; the Springfield Street Railway began horsecar service on March 10, 1870, followed by its first electric line in Forest Park two decades later on June 6, 1890. By 1905 the city had more track than New York City at that time, and the lines drove the success of suburbs like McKnight as workers began commuting further distances.
On September 20, 1893, Springfielders Charles and Frank Duryea built and then road-tested the first-ever American, gasoline-powered car in Springfield. The Duryea Motor Wagon was built on the third floor of the Stacy Building in Springfield, and first publicly road-tested on Howard Bemis's farm. In 1895, the Duryea Motor Wagon won America's first-ever road race – a 54-mile (87 km) race from Chicago to Evanston, Illinois. In 1896, the Duryea Motor Wagon Company became the first company to manufacture and sell gasoline-powered automobiles. The company's motto was ""there is no better motorcar."" Immediately, Duryeas were purchased by luminaries of the times, such as George Vanderbilt. Two months after buying one of the world's first Duryeas, New York City motorist Henry Wells hit a bicyclist – the rider suffered a broken leg, Wells spent a night in jail – and that was Springfield's peripheral role in the first-ever automobile accident.
In 1899, the Springfield Ethnological and Natural History Museum (now the Springfield Science Museum) opened in its new building on October 16, 1899. Prior to this, the museum had existed as a curiosities collection established in December 1859 in City Hall, later hosted at the City Library beginning in 1871."
19th century -> The birthplace of basketball,"Today, the city of Springfield is known worldwide as the birthplace of the sport of basketball. In 1891, James Naismith, a theology graduate, invented the sport of basketball at the YMCA International Training School – now known as Springfield College – to fill-in the gap between the football and baseball seasons. The first game of basketball ever played took place in the Mason Square district of Springfield. (The game's score was 1 – 0). As of 2011, the exact spot where the first game took place is memorialized by an illuminated monument. The first building to serve as an indoor basketball court resides at Wilbraham & Monson Academy in suburban Wilbraham, and has since been converted into a dormitory (Smith Hall). In 1912, the first ever specifically crafted basketball was produced in Springfield by the Victor Sporting Goods Company. As of 2011, Springfield-based Spalding is the world's largest producer of basketballs, and produces the official basketball of the National Basketball Association.
Basketball became an Olympic sport in 1936, and since its burst of popularity during the 1980s and 1990s, has gone on to become the world's second most popular sport (after soccer).
On February 17, 1968, The Naismith Memorial Basketball Hall of Fame was opened on the Springfield College campus. In 1985, it was replaced by a larger facility on the bank of the Connecticut River. In 2002, a new, architecturally significant Hall of Fame was constructed next to the existing site, (which was subsequently converted into restaurants and an LA Fitness club). Shaped like a giant basketball and illuminated at night, the Basketball Hall of Fame is currently one of the most architecturally recognizable buildings recently constructed in Springfield.
Today, both amateur and professional basketball are an integral part of Springfield's culture. Springfield's professional basketball team, the NBA Development League Springfield Armor – the official affiliate of the Brooklyn Nets – play in the MassMutual Center, several blocks from the Basketball Hall of Fame and the site of the first-ever basketball game. Basketball-related events take place in Springfield year-round, including the Basketball Hall of Fame's annual enshrinement ceremony, the NCAA's college basketball Tip-Off Tournament, the NCAA MAAC division tournament, and the high school Hoop Hall Classic, among numerous other basketball-related events. Many non-basketball-related events in Springfield also draw inspiration from the sport; for example, the annual Hoop City Jazz Festival brings jazz greats and tens of thousands of people to the ""Hoop City.""
""Art & Soles"", a 2010 public art installation in Springfield, featured 6-foot (1.8 m) painted basketball shoes commemorating the city's history as birthplace of basketball and home of the Hall of Fame. Each of the nineteen shoes was painted by a local artist and displayed in a prominent location in the downtown area, with the overall goal of providing an artistic answer to the question “What Makes Springfield Great?” The shoes were sold at auction in March 2011 with the proceeds going to support public art in Springfield."
20th century -> The great floods of 1936 and 1938 and their effects,"In 1936, at the height of America's Great Depression, the City of Springfield suffered one of its most devastating natural disasters prior to the tornadoes of 2011. The Connecticut River flooded, reaching record heights, inundating the South End and the North End neighborhoods, where some of Springfield's finest mansions stood. Damages were estimated at $200,000,000 in 1936 dollars.
Much of the water damage was repaired after WPA money was made available to Springfield. However, two years later, high flood waters hit Springfield again. The standing flood waters were exacerbated by the New England Hurricane of 1938, which came up the east coast of the United States on September 21, 1938.
Due to Springfield's two Great Floods, large portions of the North End and South End neighborhoods no longer exist.
During the 1960s, I-91 was constructed over the areas affected by the great floods. Several of Springfield's grandest houses, including the mansion of skating blade magnate Everett Hosmer Barney, were demolished to construct the highway. Originally, plans called for the highway to be routed along the west bank of the Connecticut River, through West Springfield; however, Springfield civic officials campaigned for it to cross the river through the North End, Metro Center, and South End neighborhoods. This decision effectively cut off the City of Springfield from the Connecticut River, its greatest natural resource. In 2010, plans were announced to finally reunite Springfield with the Connecticut River."
"20th century -> Forty year decline and immigration trends -> Interstate 91 is constructed, amputating Springfield from the river","During the late 1960s, the elevated, 8-lane Interstate 91 was constructed on Springfield's riverfront – effectively blocking Springfielders' access to ""The Great River."" For generations, the land that became Interstate 91 was the city's most valuable land for both economic and recreational purposes. The I-91 construction also covered the mouth of the Mill River. Academics note that both rivers would present major economic opportunities if I-91 was altered. In 2010, the Urban Land Institute proposed a plan for Springfield to reclaim its rivers.
The original plan for Interstate 91 – detailed in the 1953 Master Highway Plan for the Springfield, Massachusetts, Metropolitan Area – called for I-91 to occupy West Springfield's Riverdale Road, (also known as U.S. Route 5), and which had been, historically, the highway used to reach Springfield from both the north and south. Indeed, between 1953 and 1958, to make way for Interstate 91, West Springfield's Riverdale Road was widened and added on to, and businesses were moved. The 1953 plan called for I-91 to connect with Springfield via several state-of-the-art bridges. In 1958, however, Springfield's city planners – believing that the river had become too polluted, and thus no longer useful – campaigned intensely for Interstate 91 to occupy Springfield's riverfront. They boasted that the construction of I-91 on Springfield's riverfront would catalyze economic growth comparable to that experienced during the great railroad expansion of the mid-19th century. However, the highway that blocks Springfield's (now clean) rivers became the city's most famous and disastrous attempt at urban renewal.
Although West Springfield had a right and legal claim to Interstate 91, State highway officials relented to Springfield's City Planners' pressures when confronted with a technicality – a short, existing section of US 5 through West Springfield that was built during the early 1950s failed to meet Interstate design standards. Thus, the plans for I-91 were shelved in West Springfield, and hastily moved to the eastern bank of the river.
From its construction until the present, Interstate 91's design flaws have contributed to logistical problems in Springfield. Due to I-91's close proximity to both Springfield's densely built downtown and the city's rail lines and riverfront, no more than a few businesses could be built to capitalize on highway traffic. Thus, Springfield never received the promised economic benefit from I-91 – indeed, the highway's construction coincided with the start of Springfield's four decades of economic decline. Also, throughout Springfield, I-91 was constructed as an elevated highway, which blocked all riverfront views in downtown. Beneath the elevated highway, the City of Springfield's largest parking garage was constructed at 1756 spaces, as were a series of stone walls and grassy knolls, which have made the riverfront difficult to access by foot.
The highway construction sliced through three of Springfield's most (theretofore) desirable neighborhoods and many historical landmarks – among them, Court Square, Forest Park, and the Everett Hosmer Barney Mansion. In addition, the loss of Springfield's riverfront and the ugliness of the elevated Interstate 91 contributed to white flight from the city to its suburbs. Indeed, the word ""stupid"" has been used to describe Springfield's first, and most unfortunate attempt at urban renewal.
In 2010, the Urban Land Institute released a plan that proposed several different options for re-configuring Interstate 91. Currently, many Springfielders are enthused at the prospect of finally being reunited with the Mill River, and especially the Connecticut River."
20th century -> Forty year decline and immigration trends -> History of Springfield's skyline,"See: List of tallest buildings in Springfield, Massachusetts
As of 2011, Springfield's skyline features relatively fewer skyscrapers than most of its peer cities. The reason for this has to do with the 1908 construction of Springfield's neo-classical 1200 Main Street building, also known as 101 State Street. The building stands at 125 feet (38 m), which, at the time of its construction, caused great controversy in both Springfield and Boston because of its ""extreme height."" That year, the Massachusetts State Legislature set a maximum height for buildings in Springfield – at 125 feet (38 m) – the height of 1200 Main Street, and also the height of Court Square's Old First Church's steeple. The only exception to this law was made for the construction of Springfield's landmark, 300-foot (91 m), Italianate, Campanile – part of the Springfield Municipal Group, dedicated in 1913 by President William Howard Taft.
Springfield's building height law remained in effect until 1970, when the city's economy began to falter, and residents started to complain that Springfield looked ""old-fashioned."" In response to this, the city's 62-year-old building height law was abolished, and renowned architect Pietro Belluschi designed Tower Square in the brutalist, International style, popular at the time. Tower Square stands at just over 370 feet (110 m). In 1987, the Monarch Life Insurance Company constructed Springfield's 400-foot (120 m) tall), post-modern Monarch Place. During the building's construction, the Monarch Life Insurance Company filed for bankruptcy; however, the graceful, mirrored tower still bears the former company's name despite being owned by Peter Pan Bus.
As of 2011, the 400-foot (120 m) Monarch Place remains Springfield's tallest skyscraper; however, the city's lack of numerous skyscrapers is now looked on as a positive trait by city advisors such as the Urban Land Institute, who write that Springfield's ""Metro Center now stands out from its peers, most of which long ago demolished the human-scale architecture that made their downtowns livable."" During Springfield's resurgence in the new millennium, prominent architects – like Moshe Safdie, who built the $57 million, 2008 U.S. Federal Court Building; Gwathmey Siegel & Associates, who built the $47 million, 2004 Basketball Hall of Fame; and TRO Jung Brannen, who are building the $110 million, 2012 adaptive reuse of Springfield's original Technical High School – adapted to Springfield's human-scale to a create monumental buildings rather than attempting to ""achieve monumentalism through over-scaling,"" as has happened in other cities. With energy prices rising, Springfield's 1908 building height limit now seems like an idea that was far ahead of its time."
